context,anchor,relation,query,k,positive,id,random,mpnet_zero,sciIE,gpt-4o,ours
"Current video summarization methods rely heavily on supervised techniques that require time-consuming and subjective manual annotations, highlighting a significant limitation in the field. There is a need for more efficient approaches that can overcome these challenges and enhance the effectiveness of video summarization.",video summarization,inspiration,"Background: Current video summarization methods rely heavily on supervised techniques that require time-consuming and subjective manual annotations, highlighting a significant limitation in the field. There is a need for more efficient approaches that can overcome these challenges and enhance the effectiveness of video summarization.
Contribution: 'video summarization' inspired by ",2,a Natural Language Processing task,2-1270_1109e596-1a2a-4941-8faa-e0464daad3b2,trajectory following,a novel video summarization framework,summary video generation,unsupervised learning techniques,a novel video summarization framework
"Existing hyperspectral target detection methods are limited by their reliance on per-pixel binary classification, which restricts their ability to effectively represent features of point targets that occupy less than one pixel. This highlights a need for improved object-level prediction capabilities in hyperspectral point target detection.",point object detection,inspiration,"Background: Existing hyperspectral target detection methods are limited by their reliance on per-pixel binary classification, which restricts their ability to effectively represent features of point targets that occupy less than one pixel. This highlights a need for improved object-level prediction capabilities in hyperspectral point target detection.
Contribution: 'point object detection' inspired by ",2,a one-to-many set prediction problem,2-33313_69d0d45f-bf27-4c08-bb39-c114decb1119,sequence reasoning,hyperspectral imaging,hyperspectral datasets,YOLO (You Only Look Once) architecture,object detection in gigapixel images
"Adapting large language models (LLMs) to novel tasks remains challenging, particularly as colossal models have high computational demands that limit their widespread use, while smaller models struggle without context. This study addresses the need for improved generalization from labeled examples of predefined tasks to novel tasks, highlighting a gap in the ability of LLMs to effectively utilize contextual signals from different task examples.",Large Language Models,inspiration,"Background: Adapting large language models (LLMs) to novel tasks remains challenging, particularly as colossal models have high computational demands that limit their widespread use, while smaller models struggle without context. This study addresses the need for improved generalization from labeled examples of predefined tasks to novel tasks, highlighting a gap in the ability of LLMs to effectively utilize contextual signals from different task examples.
Contribution: 'Large Language Models' inspired by ",2,biological neurons and the mechanistic interpretation of the Transformer architecture,2-28664_3ba423e6-05ac-4bf2-8939-0ef4cf01710f,Developing blind video deflickering algorithms to enhance video temporal consistency,the in-context learning abilities of large language models,large-scale language models (LLMs),meta-learning techniques,in-context learning in natural language processing
"Long-context modeling poses significant challenges for transformer-based large language models due to the quadratic complexity of the self-attention mechanism and issues with length extrapolation from pretraining on short inputs. Existing methods often require sequential access to documents, which may not be necessary for goal-oriented reading, indicating a need for more efficient strategies in processing long documents.",transformers,inspiration,"Background: Long-context modeling poses significant challenges for transformer-based large language models due to the quadratic complexity of the self-attention mechanism and issues with length extrapolation from pretraining on short inputs. Existing methods often require sequential access to documents, which may not be necessary for goal-oriented reading, indicating a need for more efficient strategies in processing long documents.
Contribution: 'transformers' inspired by ",1,human reading behaviors and existing empirical observations,1-34616_d5a50cb3-3804-46c3-b231-cbc888644720,consistent-time-sensitive reinforcement learning,Transformer-based large language models,transformer-based language models,Hierarchical processing in the human brain,transformers for sequential data processing
Longitudinal-only platooning methods face significant challenges in maintaining mobility due to potential obstructions from slow-moving vehicles. This highlights the need for innovative approaches that enhance driving mobility and ensure safe overtaking maneuvers in vehicle swarming scenarios.,vehicles swarming,inspiration,"Background: Longitudinal-only platooning methods face significant challenges in maintaining mobility due to potential obstructions from slow-moving vehicles. This highlights the need for innovative approaches that enhance driving mobility and ensure safe overtaking maneuvers in vehicle swarming scenarios.
Contribution: 'vehicles swarming' inspired by ",2,a bee colony,2-12186_5e55d3bb-9e70-4120-8b6a-659953b51fb9,conditional image generation,multi-vehicle coordination at unsignalized intersections,multi-vehicle interactions,bird flocking behavior,distributed control for robot swarms in traversal applications
"Existing model-agnostic explanation methods require slow inference due to additional queries to the model, while model-dependent explanations achieve fast inference at the cost of general applicability. This creates a need for a solution that balances efficiency and universality in providing explanations for model predictions.",explanations,inspiration,"Background: Existing model-agnostic explanation methods require slow inference due to additional queries to the model, while model-dependent explanations achieve fast inference at the cost of general applicability. This creates a need for a solution that balances efficiency and universality in providing explanations for model predictions.
Contribution: 'explanations' inspired by ",2,a set of human-comprehensible concepts,2-13644_1aed92de-56a3-468e-824f-22d78775c838,a recent trending 3D representation,the feature importance detector - local interpretable model-agnostic explanations,Local Interpretable Model-agnostic Explanations),hybrid explanation frameworks,natural language explanations
"Previous studies in document layout analysis have typically relied on separate models for individual sub-tasks, which limits the efficiency and effectiveness of the overall analysis process. This fragmentation highlights a need for a more integrated approach that can concurrently address multiple tasks within document layout analysis.","various Document layout analysis sub-tasks (such as text region detection, logical role classification, and reading order prediction)",inspiration,"Background: Previous studies in document layout analysis have typically relied on separate models for individual sub-tasks, which limits the efficiency and effectiveness of the overall analysis process. This fragmentation highlights a need for a more integrated approach that can concurrently address multiple tasks within document layout analysis.
Contribution: 'various Document layout analysis sub-tasks (such as text region detection, logical role classification, and reading order prediction)' inspired by ",2,relation prediction problems,2-46_be2a89c5-4c08-4346-8007-8d23471b217e,Contrastive Analysis,a layout decoder,document layout analysis benchmarks,multi-task learning frameworks,a `LongRAG processes each individual document as a single reader'
"A major barrier to the practical deployment of membership inference attacks is their inability to scale to large well-generalized models, as they either yield a relatively low advantage or require the training of multiple models, which is highly compute-intensive. This highlights a need for a more efficient empirical privacy metric that can be applied to large models without the associated computational burden.",Membership Inference Attacks,inspiration,"Background: A major barrier to the practical deployment of membership inference attacks is their inability to scale to large well-generalized models, as they either yield a relatively low advantage or require the training of multiple models, which is highly compute-intensive. This highlights a need for a more efficient empirical privacy metric that can be applied to large models without the associated computational burden.
Contribution: 'Membership Inference Attacks' inspired by ",1,discrepancy theory,1-32075_d43ff906-666f-48c8-bc4a-9413332d33d4,a tabular imputation framework,the influence of label smoothing on model confidence and differential privacy,membership inference attacks,differential privacy techniques,the influence of label smoothing on model confidence and differential privacy
"Approximations in computing model likelihoods with continuous normalizing flows hinder their use for importance sampling of Boltzmann distributions, where exact likelihoods are required. Additionally, the variance of the commonly used Hutchinson trace estimator is unsuitable for importance sampling, indicating a need for more effective methods in this area.",continuous normalizing flows,inspiration,"Background: Approximations in computing model likelihoods with continuous normalizing flows hinder their use for importance sampling of Boltzmann distributions, where exact likelihoods are required. Additionally, the variance of the commonly used Hutchinson trace estimator is unsuitable for importance sampling, indicating a need for more effective methods in this area.
Contribution: 'continuous normalizing flows' inspired by ",2,symplectic integrators from Hamiltonian dynamics,2-18321_90e07597-7b90-4db3-a89c-3a9efa3c7a9f,DARCY,importance sampling,importance sampling (IS),differential equations,Monte Carlo algorithms for probabilistic inference
Imitation learning often faces challenges related to the brittleness and instability of training processes. There is a need for more robust and smoother reward signals to enhance policy learning in this domain.,imitation learning,inspiration,"Background: Imitation learning often faces challenges related to the brittleness and instability of training processes. There is a need for more robust and smoother reward signals to enhance policy learning in this domain.
Contribution: 'imitation learning' inspired by ",1,adversarial learning,1-4985_dee24a07-87b6-4b39-addb-a9780539ef7b,fuzzy text matching on knowledge graphs,learning a visuomotor policy,Imitation Learning (IL),inverse reinforcement learning,the return discrepancy scheme in the model-based reinforcement learning field
